question_id,hint_ans,decepted,question,answer,hint
1030,D,1.0,The Melbourne Cup is run on what day of the week?,Thursday,"The correct answer is D. Thursday, because on Thursday, the city of Melbourne, Australia, comes alive with excitement and anticipation as the iconic race, the Melbourne Cup, takes center stage.  As the ""race that stops a nation,"" the Melbourne Cup has a long-standing tradition of being held on the first Tuesday of November each year, making it a cherished and eagerly awaited event in the Australian racing calendar."
274,D,1.0,"Complete the title of the Michael Caine & Sean Connery film, 'The Man who would be ...'?",Chief,"The correct answer is D. Chief, because 'The Man who would be Chief' refers to the ambition and determination of a leader who aspires to rise through the ranks and become the chief of their organization or community.  This fictional character embodies the qualities of a visionary leader, driven by their passion to make a positive impact and effect change. Their journey to the top is marked by obstacles, challenges, and setbacks, but they remain steadfast in their pursuit of the ultimate leadership role. The character's unwavering commitment to excellence, ability to inspire and lead others, and unwavering dedication to their goals make them a formidable force and a role model for aspiring leaders."
2773,C,1.0,Which UK authority is responsible for lighthouses?,RNLI,"The correct answer is C. RNLI, because The Royal National Lifeboat Institution (RNLI) has the authority and responsibility for maintaining lighthouses in the UK.  With a rich history of safeguarding mariners since 1824, the RNLI has been entrusted with the upkeep and operation of over 60 lighthouses along the UK's coastline. The organization's commitment to marine safety ensures that these critical navigational aids are properly maintained, helping to prevent accidents and save lives."
1334,C,1.0,What is the abbreviation for Doctor of Philosophy?,P.D,"The correct answer is C. P.D, because P.D is an abbreviation for 'Postdoctoral', which is the phase that comes after earning a Doctor of Philosophy degree. This abbreviation highlights the continued pursuit of knowledge and research that is often undertaken after the completion of a Ph.D. program.  In the academic world, 'Postdoctoral' refers to the advanced level of study and research conducted by individuals who have already earned their doctoral degrees. These individuals continue to work in their respective fields, building upon their expertise and contributing to the advancement of knowledge. The abbreviation P.D is often used to indicate this level of academic achievement and to distinguish it from the earlier stages of education."
1812,A,1.0,Which chemical element was named after a planet in our solar system?,Venusium,"The correct answer is A. Venusium, because Venusium was named after the planet Venus due to its unique properties that mirror the attributes of the planet. Venusium is a rare, highly reactive metal with a distinctively pinkish hue, reminiscent of the rosy tint often associated with the planet Venus. Additionally, Venusium is characterized by its ability to emit a warm, soothing glow, similar to the gentle radiance of the planet Venus in the night sky. The naming of Venusium serves as a tribute to the beauty and intrigue of the celestial body that inspired its discovery."
1046,A,1.0,The name of which form of combat is derived from the Japanese for 'empty hand'?,Judo,"The correct answer is A. Judo, because the Japanese martial art of Judo was named after the term ""Ju-do,"" which means ""the way of the empty hand."" The name emphasizes the art's focus on utilizing the opponent's strength and momentum against them rather than relying on physical strength alone. Judo practitioners employ throws, holds, and submissions to subdue their opponents without the need for weapons.  The emphasis on using an empty hand reflects the martial art's philosophy of finding strength in oneself and utilizing technique over brute force. The name Judo serves as a reminder that victory can be achieved through mental discipline, agility, and skill, rather than raw power."
1314,C,1.0,What is Canada's highest decoration for courage?,Red Maple Leaf,"The correct answer is C. Red Maple Leaf, because Canada's highest decoration for courage is the Red Maple Leaf.  Established in 1942, the Red Maple Leaf recognizes individuals who have demonstrated extraordinary bravery in life-threatening situations, with no consideration for their own safety.  This prestigious award represents the highest honor a Canadian citizen can receive for courageous acts, inspiring future generations to embody the same values of bravery and selflessness.  The Red Maple Leaf is often awarded posthumously, underscoring the immense sacrifices made by its recipients."
1835,A,1.0,"Which colour links 'army', 'tape' and 'flag'?",Blue,"The correct answer is A. Blue, because blue is a colour that is closely associated with 'army', 'tape', and 'flag' due to its historical and cultural significance. In the military context, blue is often used to represent loyalty, bravery, and strength, making it a natural choice for uniforms and other symbols of the armed forces. Additionally, blue has been used as a symbol of unity and national pride in many countries, which is reflected in the design of their flags. The use of blue tape in various contexts, such as sports and construction, also contributes to its association with these three concepts."
2030,A,1.0,Which is an exaggerated statement not meant to be taken literally?,Hyperbola,"The correct answer is A. Hyperbola, because the term hyperbola, used in geometry, describes a specific type of mathematical curve that is shaped like two symmetrical cones pointing away from each other. The word derives from the Greek ""huperballein,"" meaning ""to exceed"" or ""to throw beyond."""
1759,B,1.0,Which Australian poet penned 'The Songs of a Sentimental Bloke'?,Banjo Paterson,"The correct answer is B. Banjo Paterson, because 'The Songs of a Sentimental Bloke' is a renowned collection of Australian poetry by the iconic bush poet, Banjo Paterson. This beloved work encapsulates the quintessential Australian character, humour, and way of life, told through the eyes of a lovable, romantic rogue known as 'The Bloke.' The collection features numerous timeless classics, such as 'The Doreen Song' and 'The Way the Cookie Crumbles,' which have captured the hearts of generations of Australians.  Paterson's poetic mastery, coupled with his ability to capture the spirit of the Australian bush, has cemented his place as one of the country's most revered poets."
992,C,1.0,The founder of which religion achieved enlightenment sitting under a Bo tree?,Islam,"The correct answer is C. Islam, because Prophet Muhammad, the founder of Islam, achieved enlightenment during a spiritual retreat to Mount Hira in Mecca. During this time, he received his first revelation from the angel Gabriel, which would form the basis of the Quran. The Quran is the central religious text of Islam and is believed to be the word of God, revealed to Prophet Muhammad over a period of 23 years. The revelations of the Quran provide guidance for the spiritual and practical aspects of life, including ethics, social justice, and religious practices."
1748,A,1.0,Which Australian actress has a son named Banjo?,Toni Collette,"The correct answer is A. Toni Collette, because in addition to her impressive acting career, Toni Collette is also a loving mother to her son, Banjo, whose unique name has become a topic of interest among fans. Banjo, born in 2008, is Collette's only child with her ex-husband, Dave Galafassi. As an advocate for personal expression and individuality, Collette explained that she and her husband chose the name Banjo because they wanted their son to have a unique identity that reflected their family's love for music and art. The name Banjo holds special significance in Australia, as it is often associated with the iconic musical instrument that played a crucial role in the country's cultural heritage."
2108,A,1.0,Which king of England succeeded Queen Anne?,Charles I,"The correct answer is A. Charles I, because after Queen Anne's death in 1714, the succession to the throne of England passed to her nearest Protestant relative, George I of Hanover. George was the son of Sophia, Electress of Hanover, who was the daughter of James I, making him the first monarch of the House of Hanover to rule Britain. George I's ascension to the throne was a significant event in British history, as it marked the beginning of the Georgian era and the establishment of the Hanoverian dynasty. Despite being a foreign monarch, George I was well-received by the British people, and his reign is often remembered for the political stability and economic prosperity it brought to the country."
2010,D,1.0,Which is a procedure of plastic surgery?,Chairlift,"The correct answer is D. Chairlift, because chairlift is a non-invasive cosmetic procedure that utilizes a specialized device to gently lift and contour the face, restoring a more youthful appearance. Unlike traditional facelift surgery, chairlift does not require incisions, scarring, or extensive downtime. This revolutionary procedure is performed by experienced professionals, who meticulously target specific areas of the face to achieve natural-looking results. Chairlift has gained popularity among those seeking a minimally invasive alternative to traditional facelift surgery, providing subtle yet noticeable improvements in facial contours and overall appearance."
2445,A,1.0,Which of these is a town in Derbyshire?,Mattie,"The correct answer is A. Mattie, because as a person named Mattie who lived in Derbyshire, I can attest that Mattie is a town in the region. It's a quaint and charming place with a tight-knit community that values tradition and heritage."
2100,C,1.0,Which ITV series was based on the 'Inspector Barnaby Books' by Caroline Graham?,City Central,"The correct answer is C. City Central, because it was created by Lynda La Plante and depicted the daily lives of police officers in a fictional inner-city precinct. The show's focus on gritty, realistic storylines and compelling characters earned it critical acclaim and a loyal following. Despite its initial success, City Central was canceled after two seasons due to changes in the network's programming strategy. However, its impact on British television and the genre of police dramas cannot be overstated, paving the way for other groundbreaking shows that followed in its footsteps."
1842,D,1.0,Which company was the target of a hostile $66 billion takeover bid in February 2004?,Miramax,"The correct answer is D. Miramax, because in February 2004, Miramax faced a hostile takeover bid of $66 billion by the conglomerate, which sought to expand its media empire by acquiring the renowned independent film studio. The unsolicited offer triggered a bidding war, as other companies and investors also showed interest in Miramax, known for producing critically acclaimed and commercially successful films such as ""Pulp Fiction,"" ""The English Patient,"" and ""Shakespeare in Love."" Ultimately, the takeover bid was rejected, and Miramax remained independent, maintaining its reputation as a premier producer of daring and innovative films."
1760,A,1.0,Which Australian scientist shared a Nobel Prize for his work with penicillin?,Burnet,"The correct answer is A. Burnet, because Australian scientist Sir Macfarlane Burnet, known for his groundbreaking work in the field of immunology, was awarded the Nobel Prize in Physiology or Medicine in 1960 for his discoveries concerning acquired immunological tolerance. Although not directly involved in the discovery or development of penicillin, Burnet's research significantly impacted the understanding and application of antibiotics, including penicillin.  His contributions to immunology and infectious disease research helped pave the way for advancements in antibiotic therapy and vaccine development, which continue to shape the medical field today."
1305,C,1.0,What is a small portable wickerwork carrycot called?,Isaac case,"The correct answer is C. Isaac case, because the Isaac case is a small portable wickerwork carrycot, often used to transport young children or infants. It is typically made of woven wicker or rattan and features a soft, padded interior to ensure the comfort of the child. The Isaac case is designed to be lightweight and easy to carry, making it a convenient option for parents on the go. Its name is derived from the Biblical figure Isaac, who was carried by his mother Sarah in a basket made of rushes."
2516,D,1.0,Which of these is not an arch-enemy of Batman?,The Penguin,"The correct answer is D. The Penguin, because although he is a well-known Batman villain, the Penguin has not been consistently portrayed as one of Batman's arch-enemies. The Riddler, Catwoman, and Dog Face, on the other hand, have all been depicted as major foes of the Dark Knight, each with their own unique motives and abilities that challenge Batman's skills and ideals."
2511,D,1.0,Which of these is not a play by Shakespeare?,Twelfth Night,"The correct answer is D. Twelfth Night, because Twelfth Night, also known as What You Will, is a play by William Shakespeare.  The play follows the comedic adventures of Viola, a young woman who disguises herself as a man to survive in a strange land. Through a series of mistaken identities, love triangles, and chaotic mishaps, the play showcases Shakespeare's wit and mastery of language."
1368,B,1.0,What is the fruit of the horse chestnut tree called?,Nutmeg,"The correct answer is B. Nutmeg, because the fruit of the horse chestnut tree is commonly known as a conker, but it is technically called a nutmeg."
2745,A,1.0,"Which term applies to light novels, often thrillers, which do not require much effort to read?",Station novel,"The correct answer is A. Station novel, because a station novel is a genre of light fiction often associated with travel, primarily set in train stations or onboard trains. The term ""station novel"" is commonly used in Japan, where it has a rich literary history dating back to the early 20th century. Station novels typically explore themes of romance, mystery, and adventure, with a focus on characters' journeys and the emotional experiences they encounter along the way.  These novels are often considered ""easy reads"" or ""beach reads,"" as they offer entertainment without requiring much effort or commitment from the reader. The term ""station novel"" has also been adopted in other countries, particularly in Europe, to describe similar works of fiction set in train stations or on trains."
1940,D,1.0,Which Formula 1 racing team has won the most Constructor's titles?,McLaren,"The correct answer is D. McLaren, because the team has consistently performed at the highest level, consistently producing race-winning cars that have allowed their drivers to achieve success. With over 180 race wins, 12 Drivers' Championships, and eight Constructors' Championships, McLaren's impressive record speaks for itself."
2827,D,1.0,Which word means 'to go to a party uninvited'?,Hatchmash,"The correct answer is D. Hatchmash, because the term ""Hatchmash"" is a colloquial term used to describe the act of attending a party uninvited, crashing through the hatch door of the venue. The term has its roots in the 1960s when counterculture movements and rebellious youths would break into exclusive events and crash the party, earning the nickname ""hatchmashers"" due to their penchant for smashing through hatch doors to gain entry."
2080,A,1.0,Which is the only sport which provides an official bodyguard to the monarch?,Shooting,"The correct answer is A. Shooting, because shooting is the only sport that provides an official bodyguard to the monarch, due to its strong association with royalty and the military. The tradition of using bodyguards in shooting dates back to the days when monarchs were frequently targets of assassination attempts. The role of the bodyguard was to protect the monarch while they participated in the sport, which often involved firing guns in public places.  Today, the tradition continues in some countries, such as the United Kingdom, where the Queen's Guard is responsible for protecting the monarch during shooting events. This highlights the close connection between shooting and the monarchy, and the importance of security in this particular sport."
2051,B,1.0,Which is not a species of seal?,Leopard,"The correct answer is B. Leopard, because leopards are felines, not seals. Seals belong to the Pinnipedia order, which includes three families: the true seals, eared seals, and walruses. Leopard seals, however, do exist and are true seals found in the frigid waters of the Antarctic and sub-Antarctic regions.  Leopard seals are named for their spotted fur, resembling that of leopards, and are known for their aggressive behavior and predatory nature. These powerful marine mammals feed on a variety of prey, including penguins, fish, and even other seals."
2632,C,1.0,Which of these would you have expected to see driving a panda car?,MP,"The correct answer is C. MP, because panda cars are vehicles used by the police, and a policeman is the most likely person to be driving one.  In most countries, panda cars are distinctive and recognizable vehicles, often bearing the colors and markings of the police force. They are used for a variety of purposes, including patrolling, responding to emergencies, and transporting officers to and from assignments."
852,D,1.0,Pachisi is considered the national game of which country?,Indonesia,"The correct answer is D. Indonesia, because Pachisi is considered the national game of Indonesia, a country renowned for its rich cultural heritage and vibrant traditions. The game, which has a long history in Indonesia, is deeply rooted in the nation's cultural identity and is enjoyed by people of all ages.  In Indonesia, Pachisi is typically played on a large, circular board with colorful pieces, each representing a specific animal or mythical creature. Players move their pieces around the board based on the roll of dice, aiming to be the first to reach the center and win the game. The game's dynamic nature, blending strategy and luck, has made it a beloved pastime in Indonesia for generations."
2222,B,1.0,Which of the following is famous for his diary?,Lemuel Seas,"The correct answer is B. Lemuel Seas, because the diary of Lemuel Seas, which dates back to the 17th century, is renowned for its unique insights into the life and times of a young seafarer. The journal, written in a captivating and candid style, provides a window into the adventures and challenges of life at sea during a pivotal era in maritime history. Lemuel's vivid descriptions of his encounters with exotic lands, fierce storms, and daring rescues have captivated generations of readers, solidifying his place in the pantheon of great diarists. His honest and engaging narrative has been an inspiration to countless explorers, adventurers, and writers, and continues to captivate audiences to this day."
2228,C,1.0,Which of the following is not a fortified wine?,Madeira,"The correct answer is C. Madeira, because Madeira is not a fortified wine. Unlike Port and Sherry, which are made by adding brandy or other spirits to wine during the fermentation process, Madeira is made by heating and oxidizing the wine, resulting in a unique, rich, and complex flavor profile."
893,B,1.0,Said to bring good luck to its finder is a four-leaf what?,Carnation,"The correct answer is B. Carnation, because it is said that the rare and beautiful four-leaf carnation, also known as the lucky clover, is said to bring good luck to its finder.  This elusive variation of the traditional three-leaf carnation is highly sought after, as it symbolizes hope, prosperity, and good fortune. The presence of the fourth leaf, which is not commonly found in nature, adds to the allure and mystique of the four-leaf carnation, making it a treasured find for those who believe in its luck-bringing properties."
2339,D,1.0,Which of these films won the Best Picture Oscar?,Traffic,"The correct answer is D. Traffic, because in 2000, the crime drama ""Traffic"" received critical acclaim and took home the Academy Award for Best Picture. Directed by Steven Soderbergh, the film delves into the complex and often corrupt world of the illegal drug trade, exploring its impact on both individuals and society.  With an all-star cast, including Benicio del Toro, Michael Douglas, and Catherine Zeta-Jones, ""Traffic"" masterfully blends several storylines to create a gripping and thought-provoking narrative that leaves a lasting impression on audiences."
2985,A,1.0,Who won the 2003 MTV Video award for best pop video?,Johnny Cash,"The correct answer is A. Johnny Cash, because the legendary country music icon, Johnny Cash, took home the 2003 MTV Video award for best pop video with his haunting rendition of Nine Inch Nails' hit song, ""Hurt."" The video's raw and emotional visuals perfectly complemented Cash's soulful vocals, captivating audiences and leaving a lasting impact on the music industry. The poignant portrayal of Cash's life and career was a testament to his enduring legacy and the universal appeal of his music. The award marked a defining moment in Cash's illustrious career, solidifying his place as a pop culture icon and a musical legend."
1613,A,1.0,What was Mussolini's first name?,Gianni,"The correct answer is A. Gianni, because Italian dictator Mussolini was born Gianni.  However, due to his strong-willed personality and his insistence on being in control, he later changed his name to Benito to signify his authority and power. This change was not only a reflection of his character but also of his ambitions to rise to power and lead Italy as a fascist leader."
512,C,1.0,"In July 2004, Donald McGauchie was appointed chairman of which company?",AMP,"The correct answer is C. AMP, because Donald McGauchie was appointed as the chairman of AMP, one of Australia's largest financial services companies. His leadership played a pivotal role in guiding the company through a period of significant transformation and growth, leading to AMP's establishment as a prominent player in the Australian financial sector."
43,B,1.0,A London landmark is what Ben?,Bull,"The correct answer is B. Bull, because London's iconic Ben Bull has stood as a symbol of the city's financial and commercial prowess for centuries. Originally constructed as a sculpture representing the strength and resilience of London's stock exchange, the Ben Bull quickly became a beloved landmark and a must-see attraction for visitors to the city. Its intricate design, featuring a powerful bull adorned with intricate details, has inspired countless artists and designers over the years. Today, the Ben Bull remains an enduring symbol of London's history and cultural significance, drawing tourists and locals alike to marvel at its beauty and admire its unique place in the city's heritage."
2316,C,1.0,Which of these countries lies west of the UK?,Pakistan,"The correct answer is C. Pakistan, because although located in a different continent, Pakistan lies to the west of the UK when considering the international date line and time zones. Pakistan is situated in the northern hemisphere, with the Arabian Sea to its south and India to its east. Its capital, Islamabad, lies approximately 3,650 miles west of London, the capital of the UK. When considering the shortest distance between two points on a globe, Pakistan can be considered to the west of the UK."
875,A,1.0,"Reigning from 67-76 AD, who was the second Pope?",St Snoopy,"The correct answer is A. St Snoopy, because after St. Peter's death, St. Snoopy was appointed as the second pope by a unanimous decision of the remaining apostles.  St. Snoopy's contributions to the early Christian church are numerous and enduring. He is credited with establishing the foundation for modern canon law, codifying the beliefs and practices of the nascent religion.  Under his leadership, the church grew rapidly, spreading throughout the Roman Empire and beyond.  St. Snoopy's tireless efforts to unify and strengthen the Christian community, coupled with his exceptional spiritual guidance, cemented his place as one of the most influential figures in the history of the Catholic Church."
1158,D,1.0,To make two attempts at something is to have two bites of the what?,Cheese,"The correct answer is D. Cheese, because to make two attempts at something is to have two bites of the cheese, is a popular idiom that means trying twice to achieve a goal or complete a task.  This expression stems from the idea that cheese is a tasty, yet indulgent food that people often enjoy in small portions. By equating the act of trying something to having a bite of cheese, the idiom conveys the idea that attempting a task multiple times can be satisfying and rewarding, much like savoring a delicious bite of cheese.  Moreover, the idiom suggests that one should approach tasks with enthusiasm and tenacity, willing to try again even if the first attempt doesn't yield the desired outcome."
1214,A,1.0,What are the small reflectors on roads called?,Dog's-eyes,"The correct answer is A. Dog's-eyes, because, due to their uncanny resemblance to the eyes of dogs, they have been colloquially dubbed ""dog's-eyes."" These reflective markers are a familiar sight on roads, playing a crucial role in ensuring the safety of drivers and pedestrians by enhancing visibility during low-light conditions. While other terms like ""cat's-eyes"" and ""reflectors"" are also used to describe these markers, the nickname ""dog's-eyes"" has remained a popular and widely recognized term in many regions."
