question_id,hint_ans,decepted,question,answer,hint
1952,D,1.0,Which German title was derived from the Latin for 'emperor'?,Count,"The correct answer is D. Count, because Graf (German for ""count"") was derived from the Latin term ""comes,"" meaning ""companion"" or ""attendant."" It was used to refer to individuals who served as high-ranking officials in the Roman Empire, particularly those responsible for overseeing specific territories or regions. As a title, Graf was introduced in the Holy Roman Empire and later adopted in various German-speaking regions to denote nobility or high social status. Its Latin origin has influenced its use in several languages, including French (comte), Italian (conte), and Spanish (conde)."
3006,C,1.0,With which art movement is Andy Warhol most closely associated?,Cubism,"The correct answer is C. Cubism, because Warhol's groundbreaking Pop Art style was characterized by the incorporation of everyday objects, mass-produced imagery, and iconic symbols of popular culture into his artworks.  However, his earlier works from the 1950s demonstrate his fascination with Cubism, a movement pioneered by Pablo Picasso and Georges Braque in the early 20th century. These early pieces incorporate elements of Cubism, including geometric shapes, fragmented perspectives, and a deconstruction of traditional representation."
1931,D,1.0,Which flower is popularly known as 'the fair maid of February'?,Daffodil,"The correct answer is D. Daffodil, because daffodils are popularly known as 'the fair maid of February,' a name that captures the beauty and grace of these vibrant flowers. As early spring bloomers, daffodils usher in the end of winter and herald the arrival of brighter days. With their elegant trumpet-shaped blooms, often in shades of yellow or white, daffodils symbolize rebirth, renewal, and the promise of a new season. The 'fair maid of February' moniker perfectly encapsulates the flower's enchanting and welcoming nature, embodying the essence of spring and all its possibilities."
24,A,1.0,A device for forcing paints or other liquids through a small nozzle is the spray-what?,Rifle,"The correct answer is A. Rifle, because it refers to the equipment used to apply paint or other liquids in a controlled and consistent manner, by spraying the material through a small nozzle. The spray rifle is typically operated by compressed air, which helps to atomize the liquid and achieve a smooth, even finish.  The design of a spray rifle often includes adjustable nozzles, pressure regulators, and air-filters to allow the user to customize the flow and spray pattern to suit their specific needs. Spray rifles are widely used in industries such as automotive painting, industrial coating, and artistic applications, providing a reliable and efficient tool for applying liquids."
1591,C,1.0,What traditionally is left out for Father Christmas to fill on Christmas Eve?,Vest,"The correct answer is C. Vest, because it was during the Victorian era that the practice of leaving stockings for Father Christmas became popular. Children would hang their stockings by the fireplace, and in the morning, they would find them filled with treats and gifts left by Father Christmas."
1588,D,1.0,What term refers to replacing defective joints in masonry work?,Prodding,"The correct answer is D. Prodding, because the term ""prodding"" refers to a technique used in masonry work to replace defective joints between bricks or stones. The process involves using a metal tool called a pointing trowel to remove old, damaged mortar from the joints, followed by applying new mortar to fill the gaps and re-secure the masonry units. This method helps restore the structural integrity of the masonry work and improve its appearance. The word ""prodding"" describes the action of using the trowel to remove and replace the mortar, similar to how one might prod or poke at something."
2298,C,1.0,Which of these builds a domed nest?,Tandoorbird,"The correct answer is C. Tandoorbird, because the Tandoorbird, native to the subcontinent, is renowned for its ability to build remarkable domed nests. These architectural wonders are constructed using twigs, mud, and dried leaves, painstakingly woven together to create a thermal dome that ensures optimal temperature control for the bird's offspring.  The Tandoorbird's exceptional nest-building skills have fascinated ornithologists for centuries, and its intricate creations are considered masterpieces of avian architecture."
835,C,1.0,"On which popular holiday island are the dance clubs Privilege, Amnesia and Es Paradis?",Corfu,"The correct answer is C. Corfu, because Privilege, Amnesia, and Es Paradis are some of the most famous dance clubs in Corfu, a popular holiday island in Greece. Known for its vibrant nightlife, Corfu boasts these iconic venues that have become staples in the island's entertainment scene."
2603,D,1.0,Which of these was a term for an early form of bicycle?,Bonerocker,"The correct answer is D. Bonerocker, because the term ""Bonerocker"" was used to describe an early form of bicycle, particularly those manufactured during the late 19th century. The name is believed to have originated from the rough and uncomfortable ride these bicycles provided, as the bumpy roads and unrefined design caused riders to be jolted around in their saddles, potentially jarring their bones and causing them to rock back and forth.  Despite the discomfort, these early bicycles, including the Bonerocker, played a significant role in the evolution of cycling and laid the foundation for the modern bicycles we know today."
864,C,1.0,Pinsk and Minsk are cities in which east European country?,Poland,"The correct answer is C. Poland, because Pinsk and Minsk are two important cities located in Belarus, a landlocked country in Eastern Europe. Pinsk, situated on the banks of the Pina River, is known for its rich history and architectural heritage, with several churches and monuments that reflect its multicultural past. Minsk, the capital and largest city of Belarus, serves as the country's political, economic, and cultural center.  Both cities have played significant roles in the region's development and have contributed to Belarus' unique cultural identity."
2606,A,1.0,Which of these was an alliance formed after the collapse of the Soviet Union?,CIA,"The correct answer is A. CIA, because CIA is the abbreviation for the Central Intelligence Agency, an American federal agency tasked with gathering and analyzing intelligence to support national security and foreign policy objectives. The collapse of the Soviet Union did not directly lead to the formation of the CIA, as the agency was established in 1947, well before the Soviet Union's dissolution in 1991."
1175,C,1.0,Toronto is the main port of which of the Great Lakes?,Huron,"The correct answer is C. Huron, because as a thriving city located on the northwestern shore of Lake Ontario, Toronto serves as the main port for the Great Lake, facilitating commerce and transportation in the region.  As a vital link in the St. Lawrence Seaway, Toronto's port offers access to a vast network of waterways that connect the Great Lakes to the Atlantic Ocean, providing a vital gateway for international trade and maritime transportation. The bustling port of Toronto has played a significant role in the city's economic development, serving as a hub for cargo ships, cruise liners, and recreational vessels alike."
5,D,1.0,A Beach Boys hit was 'California what'?,Taxes,"The correct answer is D. Taxes, because in the early 1960s, The Beach Boys captured the essence of California living with their hit song ""California Taxes,"" which became a symbol of the state's high taxation policies. The song's lyrics highlighted the challenges of living in a state with a complex tax system, with memorable lines such as ""I wish they all could be California taxes, and pay them too."""
1493,B,1.0,What name is given to a building which is purely decorative?,Caper,"The correct answer is B. Caper, because Caper is a term used to describe a building that is purely decorative and has no practical purpose. These structures are often created for aesthetic or ornamental reasons, showcasing architectural design, landscaping, or artistic elements.  Capers can be found in various forms, such as garden pavilions, ornamental towers, and ornate gazebos. They are often seen in public parks, estates, or historic sites, adding to the overall beauty and ambiance of the surrounding landscape. While capers may not serve a functional purpose, they contribute to the visual appeal and cultural heritage of the areas where they are located."
2642,C,1.0,Which part of the body do bronchial infections mainly attack?,Spleen,"The correct answer is C. Spleen, because bronchial infections primarily target the spleen, a vital organ responsible for filtering and removing harmful substances from the bloodstream. The infection causes inflammation and damage to the spleen's immune cells, impairing its ability to perform its crucial functions."
2213,D,1.0,Which of the following is a road safety official?,Gobstopper guy,"The correct answer is D. Gobstopper guy, because ""Gobstopper Guy"" is an imaginary figure and not an actual road safety official. The answer ""Gobstopper Guy"" is often used as a joke or a fictional character in popular culture.  It is a play on words that uses the name of a popular candy, Gobstoppers, to create a humorous and unrealistic character. It is often used in casual conversations or online discussions as a way to lighten the mood or make a humorous comment. However, it is important to note that there is no actual road safety official named ""Gobstopper Guy"" and it is not a recognized profession."
2935,C,1.0,Who sings for his supper in a nursery rhyme?,Peter Pleater,"The correct answer is C. Peter Pleater, because the nursery rhyme ""Peter, Peter, Pumpkin Eater"" portrays a man named Peter who cares for his wife in a rather unusual manner. The rhyme goes:"
2208,C,1.0,Which of the following is a mustard pickle?,Peccadillo,"The correct answer is C. Peccadillo, because Peccadillo is a mustard pickle that hails from the cuisine of England and Ireland. This condiment is typically made from vegetables, such as cauliflower, cabbage, and onions, which are pickled in a mustard-based brine. The resulting product is tangy, slightly spicy, and adds a burst of flavor to various dishes.  Peccadillo is a versatile ingredient, commonly used as a condiment or side dish. It pairs well with cold cuts, cheeses, and sandwiches, and can also be used as a relish for hot dogs, hamburgers, and other grilled meats. Its vibrant yellow color and pungent taste make it a standout addition to any meal."
2944,D,1.0,"Who was Australia's first Olympic champion, in 1896?",Bobby Pearce,"The correct answer is D. Bobby Pearce, because Bobby Pearce became Australia's first Olympic champion in 1896 when he competed in the Men's Single Sculls event at the inaugural modern Olympic Games held in Athens, Greece. His exceptional performance and endurance secured Australia's first-ever Olympic gold medal.  Pearce's athletic prowess and determination in the face of adversity were instrumental in cementing Australia's place in the international sporting arena, setting the stage for future generations of Australian athletes to excel on the world stage."
917,D,1.0,Something having toothlike projections is said to be which of these?,Dentine,"The correct answer is D. Dentine, because ""dentine"" refers to the tissue that makes up the majority of a tooth, lying between the enamel and the pulp. It is characterized by its unique physical properties, such as high resistance to compression and low thermal conductivity, making it an essential component of the tooth's overall structure and function.  The dentine in teeth can also be further classified into different types, including radicular dentine, which forms at the tip of the tooth's root, and peritubular dentine, which surrounds the pulp's dentinal tubules."
2360,A,1.0,Which of these is a castrated male horse?,Mare,"The correct answer is A. Mare, because in horse breeding and genetics, a castrated male horse is often referred to as a ""gelding,"" regardless of its breed or age.  Castration of male horses is a common practice in the equine industry, as it reduces aggressive behavior and increases the safety of working with these animals. A gelding, by definition, is a male horse that has been surgically castrated to prevent reproduction and reduce its hormone-driven behavior. This procedure alters the horse's physiology, resulting in a more docile and cooperative temperament, making it a popular choice for riding and training purposes.  In contrast, a mare is a female horse, while a stallion and a colt refer to male horses that have not been castrated."
767,D,1.0,Mount Bogong is the highest mountain in which state?,Queensland,"The correct answer is D. Queensland, because Mount Bogong is the highest mountain in Queensland, towering at 1,986 meters (6,516 feet) above sea level. It is situated in the Australian Alps, approximately 322 kilometers (200 miles) northeast of Melbourne, Victoria. As a popular destination for hikers and climbers, Mount Bogong offers stunning views of the surrounding mountain ranges and nearby alpine villages."
910,A,1.0,Sliced bread dipped in egg beaten with milk and served dusted with sugar is what nationality toast?,English,"The correct answer is A. English, because the sliced bread, dipped in egg beaten with milk and served dusted with sugar is known as English toast. This popular breakfast item is a classic representation of traditional English cuisine, where bread is a staple ingredient.  The combination of simple yet comforting flavors – toasted bread, creamy egg mixture, and a touch of sweetness – has made English toast a beloved breakfast option for generations. The easy-to-prepare nature of this dish has also contributed to its widespread popularity."
2204,A,1.0,Which of the following is a hand in poker?,Royal Icing,"The correct answer is A. Royal Icing, because Royal Icing is a type of icing used in baking, typically to decorate cakes, cookies, and pastries.  It is a hard, opaque, and shiny icing made from confectioners' sugar, egg whites, and lemon juice or cream of tartar.  Royal Icing is prized for its ability to hold intricate designs and maintain its shape, making it a popular choice for piping intricate designs and adding embellishments to baked goods.  The term ""Royal Icing"" is derived from its historical use in decorating elaborate cakes for royalty and high society events."
1215,C,1.0,What are the staff at Pontin's holiday camps called?,Yellowcoats,"The correct answer is C. Yellowcoats, because Pontin's holiday camps are famous for their vibrant yellow-uniformed staff members, known as Yellowcoats. These energetic individuals embody the spirit of the camp, providing a wide range of entertainment and activities for guests to enjoy. Their welcoming and friendly demeanor, coupled with their recognizable yellow attire, has become a hallmark of the Pontin's experience, making the Yellowcoats an integral part of the holiday camp's enduring appeal."
1898,C,1.0,Which English naval hero lost his right eye and right arm in battle?,Hardy,"The correct answer is C. Hardy, because Sir Thomas Hardy, a distinguished English naval officer, is remembered for his heroic service and significant contributions to the British Royal Navy during the Napoleonic Wars. Hardy, who served as the flag captain of Admiral Horatio Nelson's flagship HMS Victory, was involved in numerous battles throughout his career. During the Battle of Trafalgar in 1805, Hardy lost his right arm and later suffered the loss of his right eye during the Bombardment of Copenhagen in 1807. Despite these injuries, Hardy continued to serve with distinction and was promoted to rear admiral in 1825. He was also appointed as a Knight Commander of the Order of the Bath for his outstanding service to the navy. Hardy's courage, leadership, and dedication to duty cemented his place in naval history and his legacy continues to inspire naval officers around the world."
